{
  "$schema": "./node_modules/winnetoujs/schemas/win.config.schema.json",
  "defaultLang": "en-us",
  "publicPath": "/",
  "constructosPath": "./constructos",
  "constructosOut": "./js/constructos",
  "apps": [
    {
      "entry": "./js/app.js",
      "out": "./release"
    }
  ],
  "sass": [
    {
      "entryFolder": "./sass",
      "outFolder": "./release"
    }
  ]
}
